{
  "schema_version": "s2_11_g0_5_pre_authorization@4.0.0",
  "report_id": "s2_11_g0_5_pre_authorization_v4",
  "build_note": "Deterministic S2.11 / G0.5 corrective decision capsule v4; every state judgment is re-derived from current on-disk assets, manifests, hashes or executed independent verifiers; article license CC BY 4.0 (article-only) is separated from artifact code/data license (unknown_pending_confirmation); the adapter is the hardened synthetic/shadow implementation; G4 authorizes only a future gate-application checkpoint and G5 is not authorization-ready; authorization sentences are DRY-RUN text, nothing is applied, no gate is flipped and no Gold is created.",
  "supersedes": [
    {
      "path": "outputs/reports/s2_11_license_adapter_readiness_v2.json",
      "sha256": "8d271f59e2c6d24006ab7139509a6cf3b96d4a276a3d88c019b1a83db4b5a2e0",
      "reason": "2026-08-11 license/adapter readiness v2; superseded as a decision entry by v3 and now by v4; historical file stays unmodified."
    },
    {
      "path": "outputs/reports/s2_11_data_qualification_mapping_dry_run.json",
      "sha256": "9a8835ec27c3e64c0d38a8b2dbf59d3ab78b5949cb7a39ccb505fd2d67f5a994",
      "reason": "2026-08-11 data-qualification & mapping dry-run; superseded as the decision entry by v3 and now by v4; historical file stays unmodified."
    },
    {
      "path": "outputs/reports/g0_7_barrientos_adapter_registry_dry_run.json",
      "sha256": "bb65cca291aa9338429e5f114d44df0c95f36dc46a45cc9204d62ca8faa46278",
      "reason": "2026-08-11 G0.7 adapter registry dry-run; superseded by v3/v4 synthetic/shadow adapter reports; historical file stays unmodified."
    },
    {
      "path": "outputs/reports/g0_7_barrientos_adapter_registry_dry_run.md",
      "sha256": "04029f864ae0e5a0eafe2ee14a1c510477b0ecf1091d5510dd82e7591efbf280",
      "reason": "Markdown rendering of the same superseded registry dry-run; preserved unmodified."
    },
    {
      "path": "configs/schemas/s2_11_g0_5_pre_authorization_v3.schema.json",
      "sha256": "50d0efd0432f965b34c8d211ff5ef1d31b73fbf4479862d82618a2f33744e0a1",
      "reason": "v3 schema; kept byte-exact. v4 supersedes the v3 license four-state (v3 treated the article CC BY as not-yet-confirmed), adapter-completeness (v3 adapter lacked field-level provenance and formal evidence bindings) and G4/G5 readiness (v3 marked G5 ready) judgments."
    },
    {
      "path": "scripts/build_s2_11_g0_5_pre_authorization_v3.py",
      "sha256": "89ce3684fddcf582c859b85547c367cc8a84038a9b5269f1cd7b8ceb1479b537",
      "reason": "v3 builder; kept byte-exact; its current-state judgments are superseded by the v4 builder."
    },
    {
      "path": "scripts/verify_s2_11_g0_5_pre_authorization_v3.py",
      "sha256": "830f6aad3e3e597c10dd3bef9f5cc32e5b67d12e314d9e99b23f04a9b662c553",
      "reason": "v3 verifier; kept byte-exact; v4 verifier adds the corrected license four-state, promotion readiness and gate-ordering checks."
    },
    {
      "path": "tests/test_s2_11_g0_5_pre_authorization_v3.py",
      "sha256": "324987d70c8caf0a1d4bee70f16fc6051bf770e04aa29d25549712e560834cd4",
      "reason": "v3 focused tests; kept byte-exact; v4 adds the corrective test cases."
    },
    {
      "path": "outputs/reports/s2_11_g0_5_pre_authorization_v3.json",
      "sha256": "7c380a171423e2fd859166e0307be84d5455ed323c07caf387b1d453c266a72b",
      "reason": "v3 decision report; its license four-state, adapter-completeness and G4/G5 readiness judgments are superseded by v4; the file stays byte-exact."
    },
    {
      "path": "outputs/reports/s2_11_g0_5_pre_authorization_v3.md",
      "sha256": "557f30b9253445a349311c1fe0a604f8171428ac2fa062df2c3d75d10e6dc27a",
      "reason": "v3 Markdown rendering; preserved byte-exact as historical provenance."
    },
    {
      "path": "outputs/reports/s2_11_g0_5_pre_authorization_v3.manifest.json",
      "sha256": "cf2b7b577d8f8d1dcfd956d3031bf7c9ccd82f2433a2a5b90b7625431b538018",
      "reason": "v3 manifest; preserved byte-exact."
    },
    {
      "path": "outputs/reports/s2_11_g0_5_pre_authorization_v3_export_index.json",
      "sha256": "72c41725bc8153c671c0a6b411cc443cc62f7dcd765ef44d5cdab18bff719de6",
      "reason": "v3 export index; preserved byte-exact."
    }
  ],
  "state_matrix": [
    {
      "task_id": "S1.5",
      "status": "verified",
      "note": "Stage 1 Process Gold frozen and published (user-authorized 2026-08-13; 7/7 records, 135/135 label fields, 7/7 structure decisions).",
      "evidence": [
        {
          "path": "data/gold/stage1/process_records/stage1_process_gold_v1.json",
          "kind": "disk_asset",
          "sha256": "f33aa857a0796d0517a9d04cc96b0a4f316202603fe0adf66693aeb5cb444bca"
        },
        {
          "path": "data/gold/stage1/manifest.json",
          "kind": "manifest",
          "sha256": "1885dad26f43b19324f2e779a7bbed0db5b19699145d8607a59439423b23e587"
        },
        {
          "path": "outputs/reports/s1_5_process_gold_freeze_authorization_v1.manifest.json",
          "kind": "manifest",
          "sha256": "4b97762cfe3cb336a2a163bd85cbc850f9963a513af8a33185efae7d0486e25c"
        }
      ]
    },
    {
      "task_id": "S1.6",
      "status": "verified",
      "note": "Fixed-GDPR-7 formal descriptive component evaluation; post-Gold, target-aware, NOT held-out generalization evidence; P2/predictions/metrics byte-unchanged.",
      "evidence": [
        {
          "path": "data/predictions/stage1_formal_v1/formal_predictions_v1.json",
          "kind": "disk_asset",
          "sha256": "79a9b2c17185d63dc5ab5d9c47c8c592469b30f3cf7298740e593838166a94a8"
        },
        {
          "path": "data/results/stage1_formal_v1/stage1_formal_evaluation_v1.json",
          "kind": "disk_asset",
          "sha256": "a072db39b37167d76aa4e49b9845b5b563255d980b9ee00cd811f43c116a7392"
        }
      ]
    },
    {
      "task_id": "S1.7",
      "status": "frozen",
      "note": "Formal Stage 1 freeze APPLIED (2026-08-13); does NOT auto-authorize the Stage 3 Oracle.",
      "evidence": [
        {
          "path": "outputs/reports/s1_7_freezer_authorization_v1.manifest.json",
          "kind": "manifest",
          "sha256": "7712176c877c982e11ec670625aedb266f052d3d5b7a898d1a8504285990850a"
        }
      ]
    },
    {
      "task_id": "S2.10",
      "status": "verified",
      "note": "Three-method formal capsules and the formal three-method comparison are published and independently verified; new LLM calls 0.",
      "evidence": [
        {
          "path": "outputs/reports/b0_formal_arm_v1.manifest.json",
          "kind": "manifest",
          "sha256": "095a839fe7a98ed24de3afb3d840d1af5596f28988dae0429154f5b024f47c09"
        },
        {
          "path": "outputs/reports/direct_llm_formal_arm_v1.manifest.json",
          "kind": "manifest",
          "sha256": "f0f86318259de87c9557781b69d2573a13bb25469db194905cfc216fef94d133"
        },
        {
          "path": "outputs/reports/sun_llm_fallback_formal_arm_v1.manifest.json",
          "kind": "manifest",
          "sha256": "0b5e32852028d83b920da7fd9695f0985def37724f792d6e81630a057ea41f18"
        },
        {
          "path": "outputs/reports/stage2_formal_three_method_comparison_v1.json",
          "kind": "disk_asset",
          "sha256": "c9d76544a36ca4c27939d8090a8bfafc6da690a2e5d2b5d09624b27b4f9cf740"
        }
      ]
    },
    {
      "task_id": "S2.11",
      "status": "blocked",
      "blockers": [
        "license: unknown_pending_confirmation (no local declaration; external evidence pending)",
        "data activation authorization: NOT granted (references/ stays read-only)",
        "mapping decision: modality 3->4 mapping table / adjudication not decided",
        "human Gold: required for external-label qualification; not started",
        "G0.5 complexity rules: not frozen before results (retrospective only today)",
        "Barrientos adapter (S2-BARR-2): not implemented (only the contract dry-run exists)"
      ],
      "note": "Complex legal corpus NOT frozen and NOT activated; article license CC BY 4.0 (article-only) is confirmed, artifact code/data license still unknown_pending_confirmation, activation NOT authorized, mapping policy NOT approved, human Gold NOT started, G0.5 draft_not_frozen, adapter hardened synthetic/shadow only; the v4 decision capsule is the current decision entry for this gate.",
      "evidence": [
        {
          "path": "outputs/reports/s2_11_license_adapter_readiness_v2.json",
          "kind": "disk_asset",
          "sha256": "8d271f59e2c6d24006ab7139509a6cf3b96d4a276a3d88c019b1a83db4b5a2e0"
        },
        {
          "path": "outputs/reports/s2_11_data_qualification_mapping_dry_run.json",
          "kind": "disk_asset",
          "sha256": "9a8835ec27c3e64c0d38a8b2dbf59d3ab78b5949cb7a39ccb505fd2d67f5a994"
        },
        {
          "path": "src/bpc_hybrid/s2_11_barrientos_adapter.py",
          "kind": "disk_asset",
          "sha256": "2ddb8d0c4f6d8648693f3e736fb04c4be6e38491ddfc8fe4eea5555d8815378a"
        }
      ]
    },
    {
      "task_id": "S2.12",
      "status": "partial",
      "note": "Formal descriptive common error analysis delivered as RETROSPECTIVE/EXPLORATORY; full DoD blocked on S2.11.",
      "evidence": [
        {
          "path": "outputs/reports/s2_12_formal_descriptive_error_analysis_v1.json",
          "kind": "disk_asset",
          "sha256": "9f6c734002fd4d6761454e8e751e172e543ce4f1808b19d3f3513f05374619fd"
        },
        {
          "path": "outputs/reports/s2_12_formal_descriptive_error_analysis_v1.manifest.json",
          "kind": "manifest",
          "sha256": "89b3f1209c193ec872b9b01319f9003e0ba26387cbce0830f86e2054040dda06"
        }
      ]
    },
    {
      "task_id": "S2.13",
      "status": "blocked",
      "blockers": [
        "S2.11 blocked",
        "S2.12 full DoD not met (partial/retrospective only)"
      ],